[
  {
    "asset_ref": "0545d9f8ed39e17c7bb70a3060df550e5b7ca0bdb78afa6469fe749d6fe401d7",
    "first_seen_at": "2026-02-28T11:31:50.604134Z",
    "last_observed_at": "2026-02-28T11:31:50.604134Z",
    "event_count_total": 1,
    "persistence_duration_days": 0,
    "state_level": "stable",
    "last_state_update": "2026-02-28T11:31:50.604134Z"
  },
  {
    "asset_ref": "4170dd57eb4c771cd851e27a6021b1fc0ec0923d52abd40dd884d24809de94c9",
    "first_seen_at": "2026-02-28T11:31:50.604134Z",
    "last_observed_at": "2026-02-28T11:31:50.604134Z",
    "event_count_total": 1,
    "persistence_duration_days": 0,
    "state_level": "stable",
    "last_state_update": "2026-02-28T11:31:50.604134Z"
  },
  {
    "asset_ref": "asset:demo",
    "first_seen_at": "2026-03-05T00:00:00Z",
    "last_observed_at": "2026-03-05T00:00:00Z",
    "event_count_total": 1,
    "persistence_duration_days": 0,
    "state_level": "stable",
    "last_state_update": "2026-03-05T00:00:00Z"
  },
  {
    "asset_ref": "asset:demo2",
    "first_seen_at": "2026-03-05T00:00:02Z",
    "last_observed_at": "2026-03-05T00:00:02Z",
    "event_count_total": 1,
    "persistence_duration_days": 0,
    "state_level": "stable",
    "last_state_update": "2026-03-05T00:00:02Z"
  },
  {
    "asset_ref": "baf8749ec5be40845d5ca9c318e72425f69881684506dfc1e2982cf7d28c6cc5",
    "first_seen_at": "2026-02-28T11:31:50.604134Z",
    "last_observed_at": "2026-02-28T11:31:50.604134Z",
    "event_count_total": 1,
    "persistence_duration_days": 0,
    "state_level": "stable",
    "last_state_update": "2026-02-28T11:31:50.604134Z"
  },
  {
    "asset_ref": "e02e6f4035364d878a3a1dbb0fbecbec51395a19dff1d5bd30188c36280070b6",
    "first_seen_at": "2026-02-28T11:31:50.604134Z",
    "last_observed_at": "2026-02-28T11:31:50.604134Z",
    "event_count_total": 1,
    "persistence_duration_days": 0,
    "state_level": "stable",
    "last_state_update": "2026-02-28T11:31:50.604134Z"
  },
  {
    "asset_ref": "fde9789a17db9ef23f01cc10289982c437466a204528bbfa10fd4f1a731d5fd5",
    "first_seen_at": "2026-02-28T11:31:50.604134Z",
    "last_observed_at": "2026-02-28T11:31:50.604134Z",
    "event_count_total": 1,
    "persistence_duration_days": 0,
    "state_level": "stable",
    "last_state_update": "2026-02-28T11:31:50.604134Z"
  }
]